<?xml version="1.0"?>
<xs:schema xmlns:xs="http://www.w3.org/2001/XMLSchema">
    <xs:element name="spis">
        <xs:complexType>
            <xs:sequence>
                <xs:element name="osoba" maxOccurs="3">
                    <xs:complexType>
                        <xs:sequence>
                            <xs:element name="imie" type="xs:string"/>
                            <xs:element name="nazwisko" type="xs:string"/>
                            <xs:element name="wiek" type="xs:integer">
                                <xs:simpleType>
                                    <xs:restriction base="xs:integer">
                                        <xs:minInclusive value="1"/>
                                        <xs:maxInclusive value="100"/>
                                    </xs:restriction>
                                </xs:simpleType>
                            </xs:element>
                        </xs:sequence>
                    </xs:complexType>
                </xs:element>
            </xs:sequence>
        </xs:complexType>
    </xs:element>
</xs:schema>